{
  "action_space": "navigate_to_goal_2d_pixel",
  "backend": "vision_resnet",
  "clock_domain": "episode_time",
  "dataset": "lerobot/pusht",
  "episode_id": "lerobot_pusht_ep000000",
  "expert_steps": 161,
  "matched_steps": 161,
  "policy_id": "romi_vision_resnet",
  "proposal_steps": 161,
  "reference": "recorded_expert_action",
  "report_kind": "romi.counterfactual_policy_eval",
  "safety_boundary": {
    "actuator_authority": "none",
    "blocked_reason": "proposal_not_actuator_authority",
    "command_stream_emitted": false,
    "policy_authority": "proposed_only"
  },
  "samples": [
    {
      "error_px": 71.5339,
      "expert_goal": {
        "x": 233.0,
        "y": 71.0
      },
      "proposed_goal": {
        "x": 232.377,
        "y": 142.531
      },
      "time_sec": 0.0,
      "within_tolerance": false
    },
    {
      "error_px": 63.9818,
      "expert_goal": {
        "x": 229.0,
        "y": 83.0
      },
      "proposed_goal": {
        "x": 235.276,
        "y": 146.673
      },
      "time_sec": 0.1,
      "within_tolerance": false
    },
    {
      "error_px": 67.1864,
      "expert_goal": {
        "x": 229.0,
        "y": 86.0
      },
      "proposed_goal": {
        "x": 235.284,
        "y": 152.892
      },
      "time_sec": 0.2,
      "within_tolerance": false
    },
    {
      "error_px": 67.1003,
      "expert_goal": {
        "x": 230.0,
        "y": 86.0
      },
      "proposed_goal": {
        "x": 235.284,
        "y": 152.892
      },
      "time_sec": 0.3,
      "within_tolerance": false
    },
    {
      "error_px": 62.159,
      "expert_goal": {
        "x": 239.0,
        "y": 89.0
      },
      "proposed_goal": {
        "x": 229.105,
        "y": 150.366
      },
      "time_sec": 0.4,
      "within_tolerance": false
    },
    {
      "error_px": 52.942,
      "expert_goal": {
        "x": 251.0,
        "y": 95.0
      },
      "proposed_goal": {
        "x": 248.341,
        "y": 147.875
      },
      "time_sec": 0.5,
      "within_tolerance": false
    },
    {
      "error_px": 41.7393,
      "expert_goal": {
        "x": 263.0,
        "y": 102.0
      },
      "proposed_goal": {
        "x": 262.258,
        "y": 143.733
      },
      "time_sec": 0.6,
      "within_tolerance": false
    },
    {
      "error_px": 43.7296,
      "expert_goal": {
        "x": 273.0,
        "y": 108.0
      },
      "proposed_goal": {
        "x": 272.114,
        "y": 151.721
      },
      "time_sec": 0.7,
      "within_tolerance": false
    },
    {
      "error_px": 38.502,
      "expert_goal": {
        "x": 283.0,
        "y": 116.0
      },
      "proposed_goal": {
        "x": 250.672,
        "y": 136.912
      },
      "time_sec": 0.8,
      "within_tolerance": false
    },
    {
      "error_px": 66.5322,
      "expert_goal": {
        "x": 294.0,
        "y": 127.0
      },
      "proposed_goal": {
        "x": 238.425,
        "y": 163.578
      },
      "time_sec": 0.9,
      "within_tolerance": false
    },
    {
      "error_px": 27.7907,
      "expert_goal": {
        "x": 302.0,
        "y": 137.0
      },
      "proposed_goal": {
        "x": 274.317,
        "y": 134.553
      },
      "time_sec": 1.0,
      "within_tolerance": false
    },
    {
      "error_px": 58.0614,
      "expert_goal": {
        "x": 305.0,
        "y": 141.0
      },
      "proposed_goal": {
        "x": 249.196,
        "y": 157.034
      },
      "time_sec": 1.1,
      "within_tolerance": false
    },
    {
      "error_px": 50.5249,
      "expert_goal": {
        "x": 311.0,
        "y": 148.0
      },
      "proposed_goal": {
        "x": 260.521,
        "y": 145.85
      },
      "time_sec": 1.2,
      "within_tolerance": false
    },
    {
      "error_px": 60.0727,
      "expert_goal": {
        "x": 318.0,
        "y": 152.0
      },
      "proposed_goal": {
        "x": 258.277,
        "y": 158.473
      },
      "time_sec": 1.3,
      "within_tolerance": false
    },
    {
      "error_px": 31.6561,
      "expert_goal": {
        "x": 324.0,
        "y": 158.0
      },
      "proposed_goal": {
        "x": 292.871,
        "y": 163.751
      },
      "time_sec": 1.4,
      "within_tolerance": false
    },
    {
      "error_px": 78.475,
      "expert_goal": {
        "x": 332.0,
        "y": 163.0
      },
      "proposed_goal": {
        "x": 269.203,
        "y": 210.063
      },
      "time_sec": 1.5,
      "within_tolerance": false
    },
    {
      "error_px": 8.3595,
      "expert_goal": {
        "x": 339.0,
        "y": 170.0
      },
      "proposed_goal": {
        "x": 330.728,
        "y": 168.791
      },
      "time_sec": 1.6,
      "within_tolerance": true
    },
    {
      "error_px": 50.3851,
      "expert_goal": {
        "x": 346.0,
        "y": 182.0
      },
      "proposed_goal": {
        "x": 297.786,
        "y": 167.369
      },
      "time_sec": 1.7,
      "within_tolerance": false
    },
    {
      "error_px": 30.7417,
      "expert_goal": {
        "x": 352.0,
        "y": 195.0
      },
      "proposed_goal": {
        "x": 339.676,
        "y": 166.837
      },
      "time_sec": 1.8,
      "within_tolerance": false
    },
    {
      "error_px": 32.7603,
      "expert_goal": {
        "x": 357.0,
        "y": 209.0
      },
      "proposed_goal": {
        "x": 345.954,
        "y": 178.158
      },
      "time_sec": 1.9,
      "within_tolerance": false
    },
    {
      "error_px": 18.589,
      "expert_goal": {
        "x": 360.0,
        "y": 221.0
      },
      "proposed_goal": {
        "x": 353.491,
        "y": 203.588
      },
      "time_sec": 2.0,
      "within_tolerance": true
    },
    {
      "error_px": 30.2852,
      "expert_goal": {
        "x": 365.0,
        "y": 242.0
      },
      "proposed_goal": {
        "x": 340.44,
        "y": 224.28
      },
      "time_sec": 2.1,
      "within_tolerance": false
    },
    {
      "error_px": 66.6889,
      "expert_goal": {
        "x": 368.0,
        "y": 260.0
      },
      "proposed_goal": {
        "x": 313.15,
        "y": 222.067
      },
      "time_sec": 2.2,
      "within_tolerance": false
    },
    {
      "error_px": 56.2398,
      "expert_goal": {
        "x": 370.0,
        "y": 275.0
      },
      "proposed_goal": {
        "x": 315.942,
        "y": 259.489
      },
      "time_sec": 2.3,
      "within_tolerance": false
    },
    {
      "error_px": 27.8064,
      "expert_goal": {
        "x": 372.0,
        "y": 290.0
      },
      "proposed_goal": {
        "x": 353.938,
        "y": 268.859
      },
      "time_sec": 2.4,
      "within_tolerance": false
    },
    {
      "error_px": 45.3307,
      "expert_goal": {
        "x": 373.0,
        "y": 305.0
      },
      "proposed_goal": {
        "x": 333.274,
        "y": 283.165
      },
      "time_sec": 2.5,
      "within_tolerance": false
    },
    {
      "error_px": 43.7647,
      "expert_goal": {
        "x": 375.0,
        "y": 324.0
      },
      "proposed_goal": {
        "x": 342.979,
        "y": 294.167
      },
      "time_sec": 2.6,
      "within_tolerance": false
    },
    {
      "error_px": 56.4389,
      "expert_goal": {
        "x": 375.0,
        "y": 339.0
      },
      "proposed_goal": {
        "x": 320.128,
        "y": 325.794
      },
      "time_sec": 2.7,
      "within_tolerance": false
    },
    {
      "error_px": 68.5397,
      "expert_goal": {
        "x": 373.0,
        "y": 351.0
      },
      "proposed_goal": {
        "x": 307.219,
        "y": 331.75
      },
      "time_sec": 2.8,
      "within_tolerance": false
    },
    {
      "error_px": 72.8369,
      "expert_goal": {
        "x": 369.0,
        "y": 368.0
      },
      "proposed_goal": {
        "x": 296.48,
        "y": 361.209
      },
      "time_sec": 2.9,
      "within_tolerance": false
    },
    {
      "error_px": 90.0907,
      "expert_goal": {
        "x": 363.0,
        "y": 384.0
      },
      "proposed_goal": {
        "x": 273.319,
        "y": 375.418
      },
      "time_sec": 3.0,
      "within_tolerance": false
    },
    {
      "error_px": 76.3691,
      "expert_goal": {
        "x": 355.0,
        "y": 399.0
      },
      "proposed_goal": {
        "x": 278.663,
        "y": 396.798
      },
      "time_sec": 3.1,
      "within_tolerance": false
    },
    {
      "error_px": 84.4993,
      "expert_goal": {
        "x": 345.0,
        "y": 410.0
      },
      "proposed_goal": {
        "x": 262.367,
        "y": 392.34
      },
      "time_sec": 3.2,
      "within_tolerance": false
    },
    {
      "error_px": 95.9899,
      "expert_goal": {
        "x": 333.0,
        "y": 423.0
      },
      "proposed_goal": {
        "x": 242.653,
        "y": 390.575
      },
      "time_sec": 3.3,
      "within_tolerance": false
    },
    {
      "error_px": 41.948,
      "expert_goal": {
        "x": 316.0,
        "y": 434.0
      },
      "proposed_goal": {
        "x": 287.694,
        "y": 403.042
      },
      "time_sec": 3.4,
      "within_tolerance": false
    },
    {
      "error_px": 11.0433,
      "expert_goal": {
        "x": 303.0,
        "y": 441.0
      },
      "proposed_goal": {
        "x": 294.376,
        "y": 434.103
      },
      "time_sec": 3.5,
      "within_tolerance": true
    },
    {
      "error_px": 15.2499,
      "expert_goal": {
        "x": 292.0,
        "y": 445.0
      },
      "proposed_goal": {
        "x": 278.152,
        "y": 438.614
      },
      "time_sec": 3.6,
      "within_tolerance": true
    },
    {
      "error_px": 22.1131,
      "expert_goal": {
        "x": 282.0,
        "y": 447.0
      },
      "proposed_goal": {
        "x": 262.436,
        "y": 436.692
      },
      "time_sec": 3.7,
      "within_tolerance": false
    },
    {
      "error_px": 27.6105,
      "expert_goal": {
        "x": 275.0,
        "y": 448.0
      },
      "proposed_goal": {
        "x": 247.71,
        "y": 443.807
      },